{
  "schemaVersion": "1.0.0",
  "datasetId": "historical-cited-sources-unacquired",
  "source": "Sources cited by the frozen BURGAMOTS presentation; citation does not establish acquisition or use.",
  "sourceUrl": null,
  "acquired": false,
  "retrievedAt": null,
  "version": null,
  "license": null,
  "rawFiles": [],
  "transformations": [],
  "exclusions": []
}
